{
  "schema_version": "1.0.0",
  "owner_display_name": "Ruslan",
  "publication_policy": {
    "default_status": "draft",
    "searchable_status": "approved_public",
    "notes": "Only explicitly approved public records may be used as evidence about Ruslan."
  },
  "experience": [
    {
      "id": "backend-architecture-career",
      "publication_status": "draft",
      "title": "Backend development and system architecture career",
      "tags": [
        "backend",
        "architecture",
        "career"
      ],
      "keywords": [
        "backend development",
        "system architecture",
        "more than ten years",
        "бэкенд-разработка",
        "архитектура систем",
        "больше десяти лет"
      ],
      "sources": [
        {
          "type": "ruslan_statement",
          "reference": "references/my-intro.md#L1"
        }
      ],
      "summary": "Ruslan has more than ten years of experience in backend development and system architecture. He began in data science at Sberbank Life Insurance and later worked as a developer or architect, including for European companies.",
      "responsibilities": [
        "Backend development",
        "System architecture",
        "Turning existing technologies into working products"
      ],
      "outcomes": []
    },
    {
      "id": "ml-data-science-background",
      "publication_status": "draft",
      "title": "Machine-learning and data-science background",
      "tags": [
        "machine-learning",
        "data-science",
        "career"
      ],
      "keywords": [
        "ML experience",
        "NLP experience",
        "classical models",
        "actuarial data",
        "insurance data",
        "опыт ML"
      ],
      "technologies": [
        "Python",
        "LSTM"
      ],
      "sources": [
        {
          "type": "ruslan_statement",
          "reference": "references/typical-questions.md#question-1"
        }
      ],
      "period": "2014–2018",
      "summary": "Ruslan describes about four and a half years in a dedicated ML role, applying classical models to actuarial and insurance data before focusing on backend engineering and system architecture.",
      "responsibilities": [
        "Applied classical machine-learning models to actuarial and insurance data"
      ],
      "outcomes": []
    }
  ],
  "projects": [
    {
      "id": "samokat-backend-driven-ui",
      "publication_status": "draft",
      "title": "Samokat Backend-Driven UI platform",
      "tags": [
        "architecture",
        "backend",
        "mobile"
      ],
      "keywords": [
        "Samokat",
        "Самокат",
        "Backend-Driven UI",
        "BDUI",
        "ADR",
        "mobile applications"
      ],
      "sources": [
        {
          "type": "ruslan_statement",
          "reference": "references/my-intro.md#L3"
        }
      ],
      "problem": "Enable changes to the content and behavior of native mobile interfaces without requiring a new app-store release.",
      "ruslan_contribution": [
        "Joined near the start of the project as the second person after the manager and was responsible for architecture",
        "Defined the system structure",
        "Prepared architecture documentation, ADRs, and diagrams",
        "Presented and defended decisions to platform architects"
      ],
      "decisions": [
        "Defined service boundaries and API contracts for the Backend-Driven UI platform"
      ],
      "outcomes": []
    },
    {
      "id": "sber-ai-agent-anomaly-monitoring",
      "publication_status": "draft",
      "title": "Sber AI-agent anomaly-monitoring service",
      "tags": [
        "ai-agents",
        "mlops",
        "monitoring"
      ],
      "keywords": [
        "Sber",
        "Сбер",
        "AI-agent monitoring",
        "anomaly detection",
        "MLOps",
        "LSTM"
      ],
      "technologies": [
        "LSTM"
      ],
      "sources": [
        {
          "type": "ruslan_statement",
          "reference": "references/my-intro.md#L5"
        }
      ],
      "problem": "Create an anomaly-monitoring service for AI agents developed by different product teams.",
      "ruslan_contribution": [
        "Joined a new two-person team as a developer and MLOps engineer",
        "Defined the service boundaries and logic",
        "Selected and implemented a scientific approach to detecting deviations"
      ],
      "decisions": [
        "Selected the anomaly-detection approach used by the service"
      ],
      "outcomes": [
        "The team launched the product in production in four months"
      ]
    },
    {
      "id": "echo-dictation",
      "publication_status": "draft",
      "title": "Echo Dictation",
      "tags": [
        "ai-product",
        "speech",
        "product-development"
      ],
      "keywords": [
        "Echo Dictation",
        "dictation",
        "meeting transcription",
        "voice transcription"
      ],
      "sources": [
        {
          "type": "ruslan_statement",
          "reference": "references/my-intro.md#L7"
        }
      ],
      "problem": "Provide dictation and meeting transcription in an application.",
      "ruslan_contribution": [
        "Built the Echo Dictation application"
      ],
      "decisions": [],
      "outcomes": []
    },
    {
      "id": "aiva-agent-platform",
      "publication_status": "draft",
      "title": "Aiva voice and chat agent platform",
      "tags": [
        "ai-agents",
        "backend",
        "architecture",
        "product-development"
      ],
      "keywords": [
        "Aiva",
        "voice agents",
        "chat agents",
        "голосовые агенты",
        "чат-агенты",
        "telephony",
        "RAG",
        "CRM integrations"
      ],
      "technologies": [
        "Python",
        "FastAPI",
        "PostgreSQL",
        "pgvector",
        "Redis",
        "Gemini",
        "OpenAI Realtime",
        "xAI",
        "LangChain",
        "Langfuse",
        "SIP"
      ],
      "sources": [
        {
          "type": "ruslan_statement",
          "reference": "references/my-intro.md#L7"
        },
        {
          "type": "ruslan_statement",
          "reference": "references/typical-questions.md"
        }
      ],
      "problem": "Build a multi-user platform for business voice and chat agents, including telephony, knowledge retrieval, integrations, deployment, and monitoring.",
      "ruslan_contribution": [
        "Owns product and development together with a small team",
        "Built the platform's technical core and backend",
        "Designed agent execution, telephony, model-provider adapters, RAG, and business integrations",
        "Implemented deployment, monitoring, and production diagnostics"
      ],
      "decisions": [
        "Selected reusable open-source components",
        "Separated real-time model providers behind adapters",
        "Designed team, user, role, and access-control boundaries"
      ],
      "outcomes": [
        "Built a multi-user platform with separate teams, users, roles, and permissions",
        "Supported inbound enquiries, lead qualification, customer support, and outbound campaigns"
      ]
    }
  ],
  "principles": [
    {
      "id": "spec-driven-ai-development",
      "publication_status": "draft",
      "title": "Spec-driven development with AI agents",
      "tags": [
        "ai-assisted-development",
        "engineering-process",
        "architecture"
      ],
      "keywords": [
        "spec-driven development",
        "AI coding agents",
        "Codex",
        "Spec Kit",
        "ER diagrams",
        "UML",
        "BPMN",
        "Mermaid"
      ],
      "technologies": [
        "Codex",
        "Spec Kit",
        "Mermaid",
        "UML",
        "BPMN"
      ],
      "sources": [
        {
          "type": "ruslan_statement",
          "reference": "references/my-intro.md#L9"
        }
      ],
      "statement": "Use a spec-driven workflow in which AI agents help turn dictated context into requirements, questions, plans, and tasks, while the engineer reviews the artifacts and makes the decisions.",
      "application": "Ruslan provides agents with both text and diagrams, including ER, UML, and BPMN diagrams generated with Mermaid, to make system relationships and design problems easier to inspect.",
      "exceptions": []
    }
  ],
  "interview_qa": [
    {
      "id": "interview-01",
      "publication_status": "draft",
      "title": "How many years of hands-on experience do you have in ML and NLP, and which ML or LLM features have you shipped to production?",
      "tags": [
        "machine-learning",
        "llm",
        "ai-agents",
        "backend",
        "architecture",
        "observability",
        "reliability",
        "integrations",
        "devops",
        "marketing"
      ],
      "keywords": [
        "machine-learning",
        "llm",
        "ai-agents",
        "backend",
        "architecture",
        "observability",
        "reliability",
        "integrations",
        "devops",
        "marketing",
        "interview answer"
      ],
      "technologies": [],
      "sources": [
        {
          "type": "ruslan_statement",
          "reference": "references/typical-questions.md#question-1"
        }
      ],
      "question": "How many years of hands-on experience do you have in ML and NLP, and which ML or LLM features have you shipped to production?",